[
  {
    "id": 6,
    "dateAddedLocal": "08/08/2019, 14:43:40",
    "dateAddedUTC": "2019-08-08T04:43:40.743Z",
    "index": 0,
    "parentId": "1",
    "title": "Reading"
  },
  {
    "id": 92,
    "dateAddedLocal": "14/05/2019, 09:45:42",
    "dateAddedUTC": "2019-05-13T23:45:42.681Z",
    "index": 0,
    "parentId": "6",
    "title": "Mail",
    "url": "https://mail.yandex.com/?uid=1130000027189821#inbox"
  },
  {
    "id": 93,
    "dateAddedLocal": "04/08/2009, 15:56:14",
    "dateAddedUTC": "2009-08-04T05:56:14.000Z",
    "index": 1,
    "parentId": "6",
    "title": "Facebook",
    "url": "http://www.facebook.com/"
  },
  {
    "id": 94,
    "dateAddedLocal": "06/06/2019, 10:15:45",
    "dateAddedUTC": "2019-06-06T00:15:45.317Z",
    "index": 2,
    "parentId": "6",
    "title": "Messenger",
    "url": "https://www.facebook.com/messages/t/georg.wallace"
  },
  {
    "id": 95,
    "dateAddedLocal": "29/01/2016, 13:26:13",
    "dateAddedUTC": "2016-01-29T02:26:13.656Z",
    "index": 3,
    "parentId": "6",
    "title": "WhatsApp Web",
    "url": "https://web.whatsapp.com/"
  },
  {
    "id": 96,
    "dateAddedLocal": "07/05/2010, 09:30:11",
    "dateAddedUTC": "2010-05-06T23:30:11.000Z",
    "index": 4,
    "parentId": "6",
    "title": "SF REVIEWS.NET",
    "url": "http://sff180.com/"
  },
  {
    "id": 97,
    "dateAddedLocal": "07/03/2012, 11:07:28",
    "dateAddedUTC": "2012-03-07T00:07:28.542Z",
    "index": 5,
    "parentId": "6",
    "title": "xkcd",
    "url": "http://xkcd.com/"
  },
  {
    "id": 98,
    "dateAddedLocal": "13/05/2010, 13:48:47",
    "dateAddedUTC": "2010-05-13T03:48:47.000Z",
    "index": 6,
    "parentId": "6",
    "title": "Rock, Paper, Shotgun",
    "url": "http://www.rockpapershotgun.com/"
  },
  {
    "id": 100,
    "dateAddedLocal": "27/09/2018, 14:57:54",
    "dateAddedUTC": "2018-09-27T04:57:54.985Z",
    "index": 7,
    "parentId": "6",
    "title": "Messages",
    "url": "https://messages.android.com/"
  },
  {
    "id": 101,
    "dateAddedLocal": "08/08/2019, 14:43:40",
    "dateAddedUTC": "2019-08-08T04:43:40.774Z",
    "index": 8,
    "parentId": "6",
    "title": "w"
  },
  {
    "id": 115,
    "dateAddedLocal": "12/07/2012, 11:25:21",
    "dateAddedUTC": "2012-07-12T01:25:21.818Z",
    "index": 0,
    "parentId": "101",
    "title": "Australian Wine Review",
    "url": "http://www.ozwinereview.com/"
  },
  {
    "id": 116,
    "dateAddedLocal": "12/11/2012, 09:15:15",
    "dateAddedUTC": "2012-11-11T22:15:15.092Z",
    "index": 1,
    "parentId": "101",
    "title": "CellarTracker ",
    "url": "http://www.cellartracker.com/new/default.asp"
  },
  {
    "id": 102,
    "dateAddedLocal": "08/08/2019, 14:43:40",
    "dateAddedUTC": "2019-08-08T04:43:40.774Z",
    "index": 9,
    "parentId": "6",
    "title": "brew"
  },
  {
    "id": 106,
    "dateAddedLocal": "14/01/2019, 16:47:12",
    "dateAddedUTC": "2019-01-14T05:47:12.621Z",
    "index": 0,
    "parentId": "102",
    "title": "Brülosophy",
    "url": "http://brulosophy.com/"
  },
  {
    "id": 107,
    "dateAddedLocal": "04/06/2012, 09:59:02",
    "dateAddedUTC": "2012-06-03T23:59:02.899Z",
    "index": 1,
    "parentId": "102",
    "title": "AussieHomeBrewer.com",
    "url": "http://www.aussiehomebrewer.com/"
  },
  {
    "id": 108,
    "dateAddedLocal": "22/03/2013, 16:53:13",
    "dateAddedUTC": "2013-03-22T05:53:13.749Z",
    "index": 2,
    "parentId": "102",
    "title": "CoffeeSnobs",
    "url": "http://www.coffeesnobs.com.au/"
  },
  {
    "id": 109,
    "dateAddedLocal": "11/12/2017, 14:26:55",
    "dateAddedUTC": "2017-12-11T03:26:55.569Z",
    "index": 3,
    "parentId": "102",
    "title": "Brewer's Friend",
    "url": "https://www.brewersfriend.com/"
  },
  {
    "id": 110,
    "dateAddedLocal": "27/03/2019, 12:56:54",
    "dateAddedUTC": "2019-03-27T01:56:54.927Z",
    "index": 4,
    "parentId": "102",
    "title": "Step-by-step Biab (lcba Clone) 19L",
    "url": "https://aussiehomebrewer.com/threads/step-by-step-biab-lcba-clone.55617/#entry784483"
  },
  {
    "id": 111,
    "dateAddedLocal": "27/03/2019, 14:59:16",
    "dateAddedUTC": "2019-03-27T03:59:16.595Z",
    "index": 5,
    "parentId": "102",
    "title": "The Brew Shop",
    "url": "https://www.thebrewshop.com.au/"
  },
  {
    "id": 112,
    "dateAddedLocal": "18/04/2019, 14:36:11",
    "dateAddedUTC": "2019-04-18T04:36:11.479Z",
    "index": 6,
    "parentId": "102",
    "title": "QldKev's New Biab With Internal Rims | Aussie Home Brewer",
    "url": "https://aussiehomebrewer.com/threads/qldkevs-new-biab-with-internal-rims.68324/"
  },
  {
    "id": 113,
    "dateAddedLocal": "15/05/2019, 09:26:48",
    "dateAddedUTC": "2019-05-14T23:26:48.295Z",
    "index": 7,
    "parentId": "102",
    "title": "HomeBrewTalk",
    "url": "https://www.homebrewtalk.com/forum/"
  },
  {
    "id": 114,
    "dateAddedLocal": "15/05/2019, 09:27:53",
    "dateAddedUTC": "2019-05-14T23:27:53.392Z",
    "index": 8,
    "parentId": "102",
    "title": "Vinepair",
    "url": "https://vinepair.com/"
  },
  {
    "id": 103,
    "dateAddedLocal": "08/08/2019, 14:43:40",
    "dateAddedUTC": "2019-08-08T04:43:40.774Z",
    "index": 10,
    "parentId": "6",
    "title": "Bread"
  },
  {
    "id": 104,
    "dateAddedLocal": "19/04/2019, 07:21:06",
    "dateAddedUTC": "2019-04-18T21:21:06.566Z",
    "index": 0,
    "parentId": "103",
    "title": "Brasserie Bread's wholemeal loaf recipe",
    "url": "https://www.goodfood.com.au/recipes/brasserie-breads-wholemeal-loaf-recipe-20140728-3covt"
  },
  {
    "id": 105,
    "dateAddedLocal": "19/04/2019, 07:22:38",
    "dateAddedUTC": "2019-04-18T21:22:38.622Z",
    "index": 1,
    "parentId": "103",
    "title": "No-knead sourdough cooked in a cast-iron pot... what? | Moorlands Eater",
    "url": "https://moorlandseater.com/no-knead-sourdough/"
  },
  {
    "id": 117,
    "dateAddedLocal": "08/08/2019, 16:36:53",
    "dateAddedUTC": "2019-08-08T06:36:53.491Z",
    "index": 2,
    "parentId": "103",
    "title": "",
    "url": "https://codeload.github.com/zsh-users/zsh-autosuggestions/tar.gz/v0.6.3"
  },
  {
    "id": 7,
    "dateAddedLocal": "08/08/2019, 14:43:40",
    "dateAddedUTC": "2019-08-08T04:43:40.743Z",
    "index": 1,
    "parentId": "1",
    "title": "FED"
  },
  {
    "id": 49,
    "dateAddedLocal": "07/03/2012, 11:07:29",
    "dateAddedUTC": "2012-03-07T00:07:29.447Z",
    "index": 0,
    "parentId": "7",
    "title": "Smashing Magazine",
    "url": "http://www.smashingmagazine.com/"
  },
  {
    "id": 50,
    "dateAddedLocal": "25/07/2017, 08:44:16",
    "dateAddedUTC": "2017-07-24T22:44:16.799Z",
    "index": 1,
    "parentId": "7",
    "title": "Front-End Front",
    "url": "https://frontendfront.com/"
  },
  {
    "id": 51,
    "dateAddedLocal": "26/04/2013, 11:40:37",
    "dateAddedUTC": "2013-04-26T01:40:37.022Z",
    "index": 2,
    "parentId": "7",
    "title": "A List Apart",
    "url": "http://alistapart.com/"
  },
  {
    "id": 52,
    "dateAddedLocal": "17/09/2009, 10:15:04",
    "dateAddedUTC": "2009-09-17T00:15:04.000Z",
    "index": 3,
    "parentId": "7",
    "title": "CSS-Tricks",
    "url": "http://css-tricks.com/"
  },
  {
    "id": 53,
    "dateAddedLocal": "10/10/2016, 23:03:06",
    "dateAddedUTC": "2016-10-10T12:03:06.361Z",
    "index": 4,
    "parentId": "7",
    "title": "Echo JS - JavaScript News",
    "url": "http://www.echojs.com/"
  },
  {
    "id": 125,
    "dateAddedLocal": "27/08/2019, 11:20:42",
    "dateAddedUTC": "2019-08-27T01:20:42.728Z",
    "index": 5,
    "parentId": "7",
    "title": "Repos",
    "url": "https://github.com/Stenners?tab=repositories"
  },
  {
    "id": 121,
    "dateAddedLocal": "26/08/2019, 10:33:02",
    "dateAddedUTC": "2019-08-26T00:33:02.015Z",
    "index": 6,
    "parentId": "7",
    "title": "RealSpot"
  },
  {
    "id": 123,
    "dateAddedLocal": "26/08/2019, 10:33:29",
    "dateAddedUTC": "2019-08-26T00:33:29.228Z",
    "index": 0,
    "parentId": "121",
    "title": "dbdiagram.io",
    "url": "https://dbdiagram.io/d/5d606439ced98361d6ddde9b"
  },
  {
    "id": 127,
    "dateAddedLocal": "20/09/2019, 14:53:54",
    "dateAddedUTC": "2019-09-20T04:53:54.736Z",
    "index": 1,
    "parentId": "121",
    "title": "Bitbucket",
    "url": "https://bitbucket.org/realspotmedia/"
  },
  {
    "id": 60,
    "dateAddedLocal": "08/08/2019, 14:43:40",
    "dateAddedUTC": "2019-08-08T04:43:40.772Z",
    "index": 7,
    "parentId": "7",
      "title": "Stock photo"
  },
  {
    "id": 61,
    "dateAddedLocal": "01/02/2015, 17:10:56",
    "dateAddedUTC": "2015-02-01T06:10:56.383Z",
    "index": 0,
    "parentId": "60",
    "title": "Unsplash | Free High-Resolution Photos",
    "url": "https://unsplash.com/"
  },
  {
    "id": 62,
    "dateAddedLocal": "06/03/2018, 12:06:55",
    "dateAddedUTC": "2018-03-06T01:06:55.688Z",
    "index": 1,
    "parentId": "60",
    "title": "Pexels",
    "url": "https://www.pexels.com/"
  },
  {
    "id": 63,
    "dateAddedLocal": "05/10/2018, 14:35:58",
    "dateAddedUTC": "2018-10-05T04:35:58.928Z",
    "index": 2,
    "parentId": "60",
    "title": "unDraw",
    "url": "https://undraw.co/"
  },
  {
    "id": 64,
    "dateAddedLocal": "05/10/2018, 14:35:37",
    "dateAddedUTC": "2018-10-05T04:35:37.540Z",
    "index": 3,
    "parentId": "60",
    "title": "Subtle Patterns | Free textures for your next web project",
    "url": "https://www.toptal.com/designers/subtlepatterns/"
  },
  {
    "id": 65,
    "dateAddedLocal": "19/09/2017, 16:19:15",
    "dateAddedUTC": "2017-09-19T06:19:15.671Z",
    "index": 4,
    "parentId": "60",
    "title": "SVG Repo - Free SVG Vectors and Icons",
    "url": "https://www.svgrepo.com/"
  },
  {
    "id": 66,
    "dateAddedLocal": "01/02/2015, 17:10:48",
    "dateAddedUTC": "2015-02-01T06:10:48.729Z",
    "index": 5,
    "parentId": "60",
    "title": "StockSnap.io - Beautiful Free Stock Photos",
    "url": "https://stocksnap.io/"
  },
  {
    "id": 67,
    "dateAddedLocal": "01/02/2015, 17:09:10",
    "dateAddedUTC": "2015-02-01T06:09:10.383Z",
    "index": 6,
    "parentId": "60",
    "title": "picjumbo",
    "url": "http://picjumbo.com/"
  },
  {
    "id": 68,
    "dateAddedLocal": "10/02/2015, 17:00:54",
    "dateAddedUTC": "2015-02-10T06:00:54.974Z",
    "index": 7,
    "parentId": "60",
    "title": "Pixabay - Free Images",
    "url": "http://pixabay.com/"
  },
  {
    "id": 59,
    "dateAddedLocal": "08/08/2019, 14:43:40",
    "dateAddedUTC": "2019-08-08T04:43:40.772Z",
    "index": 8,
    "parentId": "7",
    "title": "Domain"
  },
  {
    "id": 69,
    "dateAddedLocal": "06/03/2018, 17:34:54",
    "dateAddedUTC": "2018-03-06T06:34:54.696Z",
    "index": 0,
    "parentId": "59",
    "title": "Cloudflare - Web Performance & Security",
    "url": "https://www.cloudflare.com/a/overview/stenners.com"
  },
  {
    "id": 70,
    "dateAddedLocal": "07/03/2018, 09:52:34",
    "dateAddedUTC": "2018-03-06T22:52:34.011Z",
    "index": 1,
    "parentId": "59",
    "title": "GCP - Stenners",
    "url": "https://console.cloud.google.com/home/dashboard?project=stenners-197201&_ga=2.90327839.-424768885.1520295694"
  },
  {
    "id": 71,
    "dateAddedLocal": "06/05/2019, 12:07:18",
    "dateAddedUTC": "2019-05-06T02:07:18.072Z",
    "index": 2,
    "parentId": "59",
    "title": "Netlify",
    "url": "https://app.netlify.com/sites/priceless-rosalind-b197ea/settings/general"
  },
  {
    "id": 54,
    "dateAddedLocal": "08/08/2019, 14:43:40",
    "dateAddedUTC": "2019-08-08T04:43:40.772Z",
    "index": 9,
    "parentId": "7",
    "title": "Training"
  },
  {
    "id": 90,
    "dateAddedLocal": "21/08/2018, 09:05:21",
    "dateAddedUTC": "2018-08-20T23:05:21.159Z",
    "index": 0,
    "parentId": "54",
    "title": "The Vue.js Master Class",
    "url": "https://vueschool.io/courses/the-vuejs-master-class"
  },
  {
    "id": 91,
    "dateAddedLocal": "18/12/2018, 06:54:28",
    "dateAddedUTC": "2018-12-17T19:54:28.505Z",
    "index": 1,
    "parentId": "54",
    "title": "Advanced React & GraphQL — Build Full Stack Applications with React and GraphQL",
    "url": "https://advancedreact.com/"
  },
  {
    "id": 55,
    "dateAddedLocal": "08/08/2019, 14:43:40",
    "dateAddedUTC": "2019-08-08T04:43:40.772Z",
    "index": 10,
    "parentId": "7",
    "title": "art"
  },
  {
    "id": 88,
    "dateAddedLocal": "16/03/2017, 14:15:43",
    "dateAddedUTC": "2017-03-16T03:15:43.112Z",
    "index": 0,
    "parentId": "55",
    "title": "ThreeJS Gradient",
    "url": "https://codepen.io/tr13ze/pen/pbjWwg"
  },
  {
    "id": 89,
    "dateAddedLocal": "29/01/2019, 22:41:28",
    "dateAddedUTC": "2019-01-29T11:41:28.590Z",
    "index": 1,
    "parentId": "55",
    "title": "canvas-sketch/hello-world.md at master · mattdesl/canvas-sketch · GitHub",
    "url": "https://github.com/mattdesl/canvas-sketch/blob/master/docs/hello-world.md"
  },
  {
    "id": 56,
    "dateAddedLocal": "08/08/2019, 14:43:40",
    "dateAddedUTC": "2019-08-08T04:43:40.772Z",
    "index": 11,
    "parentId": "7",
    "title": "AEM"
  },
  {
    "id": 80,
    "dateAddedLocal": "01/12/2017, 12:34:48",
    "dateAddedUTC": "2017-12-01T01:34:48.693Z",
    "index": 0,
    "parentId": "56",
    "title": "kevinweber/aem-front: Speed up development in AEM significantly. Including AEMSync and BrowserSync. Focus on front end development.",
    "url": "https://github.com/kevinweber/aem-front"
  },
  {
    "id": 81,
    "dateAddedLocal": "19/02/2018, 17:01:49",
    "dateAddedUTC": "2018-02-19T06:01:49.857Z",
    "index": 1,
    "parentId": "56",
    "title": "gavoja/aemsync: Adobe AEM Synchronization Tool",
    "url": "https://github.com/gavoja/aemsync"
  },
  {
    "id": 82,
    "dateAddedLocal": "30/04/2018, 14:03:58",
    "dateAddedUTC": "2018-04-30T04:03:58.200Z",
    "index": 2,
    "parentId": "56",
    "title": "SPA Editor Beta",
    "url": "https://www.adobeprerelease.com/beta/45638627-1E87-4FA7-F9DF-627F372AE23F"
  },
  {
    "id": 83,
    "dateAddedLocal": "08/08/2019, 14:43:40",
    "dateAddedUTC": "2019-08-08T04:43:40.773Z",
    "index": 3,
    "parentId": "56",
    "title": "AdobeTargetAnalytics"
  },
  {
    "id": 84,
    "dateAddedLocal": "28/09/2017, 10:26:34",
    "dateAddedUTC": "2017-09-28T00:26:34.832Z",
    "index": 0,
    "parentId": "83",
    "title": "@adobe/target-react-component",
    "url": "https://www.npmjs.com/package/@adobe/target-react-component"
  },
  {
    "id": 85,
    "dateAddedLocal": "28/09/2017, 10:26:43",
    "dateAddedUTC": "2017-09-28T00:26:43.006Z",
    "index": 1,
    "parentId": "83",
    "title": "How at.js Works - Adobe Target",
    "url": "https://marketing.adobe.com/resources/help/en_US/target/ov/c_how_atjs_works.html"
  },
  {
    "id": 86,
    "dateAddedLocal": "28/09/2017, 10:26:49",
    "dateAddedUTC": "2017-09-28T00:26:49.531Z",
    "index": 2,
    "parentId": "83",
    "title": "Adobe-Marketing-Cloud/target-atjs-extensions: Adobe Target extensions to at.js to support Single Page Application implementations",
    "url": "https://github.com/Adobe-Marketing-Cloud/target-atjs-extensions"
  },
  {
    "id": 87,
    "dateAddedLocal": "28/09/2017, 15:06:04",
    "dateAddedUTC": "2017-09-28T05:06:04.557Z",
    "index": 3,
    "parentId": "83",
    "title": "Adobe DTM: ContextHub Tool + dataelementchanged + Dynamic Data Layer = ??? - 33 Sticks",
    "url": "http://33sticks.com/hack-adobe-dtm-respond-dynamic-data-layer-changes/"
  },
  {
    "id": 57,
    "dateAddedLocal": "08/08/2019, 14:43:40",
    "dateAddedUTC": "2019-08-08T04:43:40.772Z",
    "index": 12,
    "parentId": "7",
    "title": "mtrack"
  },
  {
    "id": 76,
    "dateAddedLocal": "29/01/2019, 10:32:17",
    "dateAddedUTC": "2019-01-28T23:32:17.292Z",
    "index": 0,
    "parentId": "57",
    "title": "lexa dashboard - visual example",
    "url": "https://lexa-node.ourdemo.website/"
  },
  {
    "id": 77,
    "dateAddedLocal": "29/01/2019, 10:32:55",
    "dateAddedUTC": "2019-01-28T23:32:55.040Z",
    "index": 1,
    "parentId": "57",
    "title": "Poppins - Google Fonts",
    "url": "https://fonts.google.com/specimen/Poppins"
  },
  {
    "id": 78,
    "dateAddedLocal": "29/01/2019, 10:37:44",
    "dateAddedUTC": "2019-01-28T23:37:44.544Z",
    "index": 2,
    "parentId": "57",
    "title": "Recharts",
    "url": "http://recharts.org/en-US/"
  },
  {
    "id": 79,
    "dateAddedLocal": "29/01/2019, 11:23:07",
    "dateAddedUTC": "2019-01-29T00:23:07.639Z",
    "index": 3,
    "parentId": "57",
    "title": "Montserrat - Google Fonts",
    "url": "https://fonts.google.com/specimen/Montserrat"
  },
  {
    "id": 58,
    "dateAddedLocal": "08/08/2019, 14:43:40",
    "dateAddedUTC": "2019-08-08T04:43:40.772Z",
    "index": 13,
    "parentId": "7",
    "title": "PWAs"
  },
  {
    "id": 72,
    "dateAddedLocal": "30/04/2019, 11:28:42",
    "dateAddedUTC": "2019-04-30T01:28:42.860Z",
    "index": 0,
    "parentId": "58",
    "title": "PWA Checklist 2019",
    "url": "https://dev.to/uyouthe/pwa-checklist-2019-25j4"
  },
  {
    "id": 73,
    "dateAddedLocal": "30/04/2019, 11:31:14",
    "dateAddedUTC": "2019-04-30T01:31:14.976Z",
    "index": 1,
    "parentId": "58",
    "title": "About splash-screens - Appscope",
    "url": "https://appsco.pe/developer/splash-screens"
  },
  {
    "id": 74,
    "dateAddedLocal": "30/04/2019, 17:00:50",
    "dateAddedUTC": "2019-04-30T07:00:50.141Z",
    "index": 2,
    "parentId": "58",
    "title": "Building a Progressive Web App with Next.js - Part II",
    "url": "https://able.bio/drenther/building-a-progressive-web-app-with-nextjs-part-ii--98ojk46"
  },
  {
    "id": 75,
    "dateAddedLocal": "30/04/2019, 17:01:04",
    "dateAddedUTC": "2019-04-30T07:01:04.626Z",
    "index": 3,
    "parentId": "58",
    "title": "Service Workers: an Introduction  |  Web Fundamentals  |  Google Developers",
    "url": "https://developers.google.com/web/fundamentals/primers/service-workers/"
  },
  {
    "id": 8,
    "dateAddedLocal": "08/08/2019, 14:43:40",
    "dateAddedUTC": "2019-08-08T04:43:40.743Z",
    "index": 2,
    "parentId": "1",
    "title": "Accenture"
  },
  {
    "id": 37,
    "dateAddedLocal": "05/05/2017, 15:09:31",
    "dateAddedUTC": "2017-05-05T05:09:31.885Z",
    "index": 0,
    "parentId": "8",
    "title": "MyTimeAndExpenses",
    "url": "https://myte.accenture.com/OGTE/secure/TimesheetPage.aspx"
  },
  {
    "id": 38,
    "dateAddedLocal": "15/05/2019, 09:55:59",
    "dateAddedUTC": "2019-05-14T23:55:59.077Z",
    "index": 1,
    "parentId": "8",
    "title": "Reservations",
    "url": "https://reservations.accenture.com/reserve-space/"
  },
  {
    "id": 39,
    "dateAddedLocal": "05/05/2017, 21:41:17",
    "dateAddedUTC": "2017-05-05T11:41:17.569Z",
    "index": 2,
    "parentId": "8",
    "title": "People",
    "url": "https://people.accenture.com/"
  },
  {
    "id": 40,
    "dateAddedLocal": "11/05/2017, 16:37:20",
    "dateAddedUTC": "2017-05-11T06:37:20.478Z",
    "index": 3,
    "parentId": "8",
    "title": "myScheduling",
    "url": "https://myscheduling.accenture.com/Me/Index#/home"
  },
  {
    "id": 41,
    "dateAddedLocal": "17/05/2017, 17:31:28",
    "dateAddedUTC": "2017-05-17T07:31:28.040Z",
    "index": 4,
    "parentId": "8",
    "title": "Mail",
    "url": "https://myemail.accenture.com/owa/"
  },
  {
    "id": 42,
    "dateAddedLocal": "14/06/2017, 09:30:43",
    "dateAddedUTC": "2017-06-13T23:30:43.083Z",
    "index": 5,
    "parentId": "8",
    "title": "RISE Leadership Journey",
    "url": "https://rise.accenture.com/"
  },
  {
    "id": 43,
    "dateAddedLocal": "20/06/2017, 10:52:34",
    "dateAddedUTC": "2017-06-20T00:52:34.057Z",
    "index": 6,
    "parentId": "8",
    "title": "Home - myLearning",
    "url": "https://mylearning.accenture.com/myl-ui/learner/home"
  },
  {
    "id": 44,
    "dateAddedLocal": "21/11/2017, 15:37:01",
    "dateAddedUTC": "2017-11-21T04:37:01.449Z",
    "index": 7,
    "parentId": "8",
    "title": "Performance Achievement",
    "url": "https://performance.accenture.com/#/home/anthony.stenmark/profile"
  },
  {
    "id": 45,
    "dateAddedLocal": "24/01/2018, 11:50:14",
    "dateAddedUTC": "2018-01-24T00:50:14.176Z",
    "index": 8,
    "parentId": "8",
    "title": "EPS",
    "url": "https://apssc.accenture.com/eps/myhistory.aspx"
  },
  {
    "id": 46,
    "dateAddedLocal": "04/04/2018, 12:44:27",
    "dateAddedUTC": "2018-04-04T02:44:27.916Z",
    "index": 9,
    "parentId": "8",
    "title": "FED Community - Agile Board",
    "url": "https://alm.accenture.com/jira/secure/RapidBoard.jspa?rapidView=7383&projectKey=IIBGJJJM&selectedIssue=IIBGJJJM-57"
  },
  {
    "id": 47,
    "dateAddedLocal": "05/12/2018, 16:34:21",
    "dateAddedUTC": "2018-12-05T05:34:21.114Z",
    "index": 10,
    "parentId": "8",
    "title": "Leave Policy Australia",
    "url": "https://policies.accenture.com/policy/1552"
  },
  {
    "id": 119,
    "dateAddedLocal": "09/08/2019, 14:09:42",
    "dateAddedUTC": "2019-08-09T04:09:42.028Z",
    "index": 11,
    "parentId": "8",
    "title": "AWS Certification Preparation via A Cloud Guru",
    "url": "https://mylearning.accenture.com/mylearningui/learner/coursedetail/1612563"
  },
  {
    "id": 9,
    "dateAddedLocal": "08/08/2019, 14:43:40",
    "dateAddedUTC": "2019-08-08T04:43:40.744Z",
    "index": 3,
    "parentId": "1",
    "title": "AI Design System"
  },
  {
    "id": 35,
    "dateAddedLocal": "01/07/2019, 16:51:54",
    "dateAddedUTC": "2019-07-01T06:51:54.879Z",
    "index": 0,
    "parentId": "9",
    "title": "Browse AI-design-system / ai-design-system - Bitbucket",
    "url": "https://innersource.accenture.com/projects/AIDS/repos/ai-design-system/browse"
  },
  {
    "id": 36,
    "dateAddedLocal": "01/07/2019, 16:58:40",
    "dateAddedUTC": "2019-07-01T06:58:40.455Z",
    "index": 1,
    "parentId": "9",
    "title": "Trello",
    "url": "https://trello.com/b/CkDOaruh/ai-design-system"
  },
  {
    "id": 10,
    "dateAddedLocal": "08/08/2019, 14:43:40",
    "dateAddedUTC": "2019-08-08T04:43:40.744Z",
    "index": 4,
    "parentId": "1",
    "title": "PE"
  },
  {
    "id": 31,
    "dateAddedLocal": "28/06/2019, 09:43:59",
    "dateAddedUTC": "2019-06-27T23:43:59.863Z",
    "index": 0,
    "parentId": "10",
    "title": "Project Eternity",
    "url": "http://localhost:8080/"
  },
  {
    "id": 33,
    "dateAddedLocal": "28/06/2019, 12:28:42",
    "dateAddedUTC": "2019-06-28T02:28:42.616Z",
    "index": 1,
    "parentId": "10",
    "title": "Tamosheik/WOTLK-WEBSITE",
    "url": "https://github.com/Tamosheik/WOTLK-WEBSITE"
  },
  {
    "id": 34,
    "dateAddedLocal": "07/07/2019, 12:51:29",
    "dateAddedUTC": "2019-07-07T02:51:29.772Z",
    "index": 2,
    "parentId": "10",
    "title": "Project Eternity | Trello",
    "url": "https://trello.com/b/M5CU3G7v/project-eternity"
  },
  {
    "id": 118,
    "dateAddedLocal": "09/08/2019, 09:50:15",
    "dateAddedUTC": "2019-08-08T23:50:15.013Z",
    "index": 3,
    "parentId": "10",
    "title": "phpMyAdmin",
    "url": "http://localhost:8000/"
  },
  {
    "id": 11,
    "dateAddedLocal": "08/08/2019, 14:43:40",
    "dateAddedUTC": "2019-08-08T04:43:40.744Z",
    "index": 5,
    "parentId": "1",
    "title": "💀"
  },
  {
    "id": 12,
    "dateAddedLocal": "08/08/2019, 14:43:40",
    "dateAddedUTC": "2019-08-08T04:43:40.770Z",
    "index": 0,
    "parentId": "11",
    "title": "Belong"
  },
  {
    "id": 19,
    "dateAddedLocal": "08/08/2019, 14:43:40",
    "dateAddedUTC": "2019-08-08T04:43:40.770Z",
    "index": 0,
    "parentId": "12",
    "title": "training"
  },
  {
    "id": 29,
    "dateAddedLocal": "23/11/2018, 15:57:57",
    "dateAddedUTC": "2018-11-23T04:57:57.253Z",
    "index": 0,
    "parentId": "19",
    "title": "Manage Application State with Mobx-state-tree from @mweststrate on @eggheadio",
    "url": "https://egghead.io/courses/manage-application-state-with-mobx-state-tree"
  },
  {
    "id": 30,
    "dateAddedLocal": "23/11/2018, 15:59:13",
    "dateAddedUTC": "2018-11-23T04:59:13.715Z",
    "index": 1,
    "parentId": "19",
    "title": "Learn Next.js",
    "url": "https://nextjs.org/learn/"
  },
  {
    "id": 20,
    "dateAddedLocal": "06/11/2018, 11:23:31",
    "dateAddedUTC": "2018-11-06T00:23:31.747Z",
    "index": 1,
    "parentId": "12",
    "title": "Contentful",
    "url": "https://app.contentful.com/"
  },
  {
    "id": 21,
    "dateAddedLocal": "14/11/2018, 13:14:17",
    "dateAddedUTC": "2018-11-14T02:14:17.607Z",
    "index": 2,
    "parentId": "12",
    "title": "belongadmin — Bitbucket",
    "url": "https://bitbucket.org/belongadmin/belong-web/src"
  },
  {
    "id": 22,
    "dateAddedLocal": "14/01/2019, 14:32:42",
    "dateAddedUTC": "2019-01-14T03:32:42.666Z",
    "index": 3,
    "parentId": "12",
    "title": "Jira",
    "url": "https://belongranda.atlassian.net/secure/RapidBoard.jspa?rapidView=59&projectKey=BT"
  },
  {
    "id": 23,
    "dateAddedLocal": "27/11/2018, 09:40:44",
    "dateAddedUTC": "2018-11-26T22:40:44.967Z",
    "index": 4,
    "parentId": "12",
    "title": "Digital & App - Belong - Confluence",
    "url": "https://belongranda.atlassian.net/wiki/spaces/BEL/pages/26943468/Digital+App"
  },
  {
    "id": 24,
    "dateAddedLocal": "16/11/2018, 10:15:17",
    "dateAddedUTC": "2018-11-15T23:15:17.205Z",
    "index": 5,
    "parentId": "12",
    "title": "belong-web | Trello",
    "url": "https://trello.com/b/PPVRi73q/belong-web"
  },
  {
    "id": 25,
    "dateAddedLocal": "17/12/2018, 17:07:36",
    "dateAddedUTC": "2018-12-17T06:07:36.473Z",
    "index": 6,
    "parentId": "12",
    "title": "MuleSoft Anypoint Exchange",
    "url": "https://anypoint.mulesoft.com/exchange/?organizationId=fb8e0ed6-e37e-48f9-b5ae-904834ab2c07"
  },
  {
    "id": 26,
    "dateAddedLocal": "17/12/2018, 14:00:19",
    "dateAddedUTC": "2018-12-17T03:00:19.251Z",
    "index": 7,
    "parentId": "12",
    "title": "Jenkins",
    "url": "https://jenkins.digital.nonprod.belong-services.com.au/job/DigitalPoc/"
  },
  {
    "id": 27,
    "dateAddedLocal": "17/12/2018, 14:52:34",
    "dateAddedUTC": "2018-12-17T03:52:34.230Z",
    "index": 8,
    "parentId": "12",
    "title": "Belong-web: Storybook",
    "url": "https://digital-poc.belongtest.com.au:8081/"
  },
  {
    "id": 28,
    "dateAddedLocal": "17/12/2018, 14:52:58",
    "dateAddedUTC": "2018-12-17T03:52:58.587Z",
    "index": 9,
    "parentId": "12",
    "title": "Belong-web: App",
    "url": "https://digital-poc.belongtest.com.au:8080/"
  },
  {
    "id": 13,
    "dateAddedLocal": "08/08/2019, 14:43:40",
    "dateAddedUTC": "2019-08-08T04:43:40.770Z",
    "index": 1,
    "parentId": "11",
    "title": "ASX"
  },
  {
    "id": 14,
    "dateAddedLocal": "30/05/2019, 09:26:27",
    "dateAddedUTC": "2019-05-29T23:26:27.325Z",
    "index": 0,
    "parentId": "13",
    "title": "Node.js tutorial for DAML",
    "url": "https://github.com/digital-asset/ex-tutorial-nodejs"
  },
  {
    "id": 15,
    "dateAddedLocal": "30/05/2019, 09:26:41",
    "dateAddedUTC": "2019-05-29T23:26:41.707Z",
    "index": 1,
    "parentId": "13",
    "title": "Navigator source",
    "url": "https://github.com/digital-asset/daml/tree/master/navigator"
  },
  {
    "id": 16,
    "dateAddedLocal": "30/05/2019, 11:12:23",
    "dateAddedUTC": "2019-05-30T01:12:23.736Z",
    "index": 2,
    "parentId": "13",
    "title": "JSONForms",
    "url": "https://jsonforms.io/docs/tutorial"
  },
  {
    "id": 17,
    "dateAddedLocal": "31/05/2019, 11:30:34",
    "dateAddedUTC": "2019-05-31T01:30:34.159Z",
    "index": 3,
    "parentId": "13",
    "title": "DAML SDK documentation",
    "url": "https://docs.daml.com/index.html"
  },
  {
    "id": 18,
    "dateAddedLocal": "04/06/2019, 14:12:41",
    "dateAddedUTC": "2019-06-04T04:12:41.548Z",
    "index": 4,
    "parentId": "13",
    "title": "Node.js bindings for DAML",
    "url": "https://digital-asset.github.io/daml-js/latest/index.html"
  },
  {
    "id": 5,
    "dateAddedLocal": "11/07/2019, 11:04:34",
    "dateAddedUTC": "2019-07-11T01:04:34.925Z",
    "index": 0,
    "parentId": "2",
    "title": "AWS Certified Solutions Architect Associate Practice Exams | Udemy",
    "url": "https://www.udemy.com/aws-certified-solutions-architect-associate-amazon-practice-exams/?couponCode=TUTORIALSDOJO-G1"
  }
]
